{"$schema":"https://json-schema.org/draft/2020-12/schema","$id":"https://ayodhya.work/system/schemas/component.schema.json","title":"Ayodhya component","type":"object","required":["schemaVersion","name","slug","description","status","version","owner","lastReviewed","jobs","whenToUse","whenNotToUse","anatomy","properties","slots","events","states","variants","sizes","modes","tokensUsed","contentRules","accessibility","responsive","failureModes","examples","relatedPatterns","relatedComponents"],"properties":{"schemaVersion":{"const":"1.0.0"},"name":{"type":"string"},"slug":{"type":"string","pattern":"^[a-z0-9-]+$"},"description":{"type":"string"},"status":{"enum":["draft","beta","stable","deprecated"]},"version":{"type":"string"},"owner":{"type":"string"},"lastReviewed":{"type":"string","format":"date"},"jobs":{"type":"array"},"whenToUse":{"type":"array"},"whenNotToUse":{"type":"array"},"anatomy":{"type":"array"},"properties":{"type":"array"},"slots":{"type":"array"},"events":{"type":"array"},"states":{"type":"object","required":["system","evidence","authority","recoverability","connectivity"]},"variants":{"type":"array"},"sizes":{"type":"array"},"modes":{"type":"array"},"tokensUsed":{"type":"array"},"contentRules":{"type":"array"},"accessibility":{"type":"object","required":["role","nameRule","keyboard","focus","announcements","contrast","reducedMotion","forcedColors"]},"responsive":{"type":"object"},"failureModes":{"type":"array"},"examples":{"type":"array"},"figmaMapping":{"type":["object","null"]},"codeMapping":{"type":["object","null"]},"relatedPatterns":{"type":"array"},"relatedComponents":{"type":"array"},"migration":{"type":["object","null"]}}}
