{
  "schemaVersion": "1.0.0",
  "status": "beta",
  "version": "0.2.0",
  "owner": "Ayodhya Mohanthy",
  "lastReviewed": "2026-09-16",
  "jobs": [
    "Communicate an AI interaction state and available next action"
  ],
  "whenToUse": [
    "When the declared job matches"
  ],
  "whenNotToUse": [
    "When a native semantic element alone communicates the full state"
  ],
  "anatomy": [
    "container",
    "label",
    "state",
    "action"
  ],
  "properties": [],
  "slots": [],
  "events": [],
  "states": {
    "system": [
      "idle",
      "thinking",
      "acting",
      "done",
      "failed"
    ],
    "evidence": [
      "grounded",
      "partial",
      "absent",
      "stale"
    ],
    "authority": [
      "observe",
      "draft",
      "approve",
      "execute"
    ],
    "recoverability": [
      "undo",
      "retry",
      "correct",
      "take-over"
    ],
    "connectivity": [
      "live",
      "delayed",
      "offline"
    ]
  },
  "variants": [
    "default"
  ],
  "sizes": [
    "medium"
  ],
  "modes": [
    "light",
    "dark",
    "forced-colors"
  ],
  "tokensUsed": [
    "ayodhya.color.text.default",
    "ayodhya.color.focus.default"
  ],
  "contentRules": [
    "Use plain verbs",
    "Name effects before commitment"
  ],
  "accessibility": {
    "role": "Use the native role for the job",
    "nameRule": "Provide a concise accessible name",
    "keyboard": [
      "Tab reaches every action",
      "Enter or Space activates buttons"
    ],
    "focus": "2px visible indicator with 4px offset",
    "announcements": "Announce state changes once; batch streaming updates",
    "contrast": "WCAG 2.2 AA",
    "reducedMotion": "Remove non-essential motion",
    "forcedColors": "Preserve boundaries and focus"
  },
  "responsive": {
    "minWidth": 320,
    "desktop": 1440,
    "mobile": 390,
    "rule": "Reflow without horizontal scrolling"
  },
  "failureModes": [
    "Unknown state ID is invalid",
    "Failed action lacks recovery"
  ],
  "examples": [],
  "figmaMapping": null,
  "codeMapping": null,
  "relatedPatterns": [
    "preview-before-acting"
  ],
  "relatedComponents": [],
  "migration": null,
  "$schema": "../component.schema.json",
  "name": "Field",
  "slug": "field",
  "description": "Field flagship component contract."
}